{
  "accepted": false,
  "artifacts": [
    {
      "artifactDigest": null,
      "component": "data-source-harness",
      "repository": "https://github.com/caglarsubas/data-source-harness",
      "revision": "74cd16877253d7dbc0995063b8f611be767376f8"
    },
    {
      "artifactDigest": null,
      "component": "ADLC",
      "repository": "https://github.com/caglarsubas/agent-hook-v2",
      "revision": "9bf6c11028a70944fda3f5e7ef315915768b9be7"
    },
    {
      "artifactDigest": null,
      "component": "Python-SDK",
      "repository": "https://github.com/caglarsubas/planeon-orchestra-python-sdk",
      "revision": "3a4012d809e6ed00a3f05be940c5278eac20a166"
    },
    {
      "artifactDigest": null,
      "component": "model-plane",
      "repository": "https://github.com/caglarsubas/llm_inference_engine",
      "revision": "e820728e14a6121c0549f4ef6d51baacd1fec573"
    }
  ],
  "blockers": [
    "ADLC:artifact-digest-missing",
    "Python-SDK:artifact-digest-missing",
    "data-source-harness:artifact-digest-missing",
    "model-plane:artifact-digest-missing",
    "whitegoods.event-stream:image-digest-missing",
    "whitegoods.event-stream:live-verification-missing",
    "whitegoods.postgresql:image-digest-missing",
    "whitegoods.postgresql:live-verification-missing",
    "whitegoods.service-api:image-digest-missing",
    "whitegoods.service-api:live-verification-missing",
    "whitegoods.object-store:image-digest-missing",
    "whitegoods.object-store:live-verification-missing",
    "ADLC:pr-ci:missing",
    "ADLC:publication:missing",
    "ADLC:local-image-load:missing",
    "ADLC:local-startup:missing",
    "ADLC:runtime:missing",
    "ADLC:fault:missing",
    "ADLC:soak:missing",
    "ADLC:protocol-conformance:missing",
    "ADLC:stakeholder:missing",
    "Python-SDK:pr-ci:missing",
    "Python-SDK:exact-main-ci:missing",
    "Python-SDK:publication:missing",
    "Python-SDK:local-image-load:missing",
    "Python-SDK:local-startup:missing",
    "Python-SDK:runtime:missing",
    "Python-SDK:fault:missing",
    "Python-SDK:soak:missing",
    "Python-SDK:protocol-conformance:missing",
    "Python-SDK:stakeholder:missing",
    "data-source-harness:pr-ci:missing",
    "data-source-harness:publication:missing",
    "data-source-harness:local-image-load:missing",
    "data-source-harness:local-startup:missing",
    "data-source-harness:runtime:missing",
    "data-source-harness:fault:missing",
    "data-source-harness:soak:missing",
    "data-source-harness:protocol-conformance:missing",
    "data-source-harness:stakeholder:missing",
    "model-plane:pr-ci:missing",
    "model-plane:publication:missing",
    "model-plane:local-image-load:missing",
    "model-plane:local-startup:missing",
    "model-plane:runtime:missing",
    "model-plane:fault:missing",
    "model-plane:soak:missing",
    "model-plane:protocol-conformance:missing",
    "model-plane:stakeholder:missing"
  ],
  "campaignId": "phase7-white-goods-local-laptop-acceptance",
  "costBoundary": {
    "externalMutations": [],
    "provisioningAuthorized": false,
    "resourcesCreated": []
  },
  "evidence": [
    {
      "artifactDigest": null,
      "component": "data-source-harness",
      "observedAt": "2026-08-28T00:00:00+00:00",
      "references": [
        "https://github.com/caglarsubas/data-source-harness/commit/74cd16877253d7dbc0995063b8f611be767376f8"
      ],
      "revision": "74cd16877253d7dbc0995063b8f611be767376f8",
      "stage": "source",
      "status": "passed"
    },
    {
      "artifactDigest": null,
      "component": "ADLC",
      "observedAt": "2026-08-28T00:00:00+00:00",
      "references": [
        "https://github.com/caglarsubas/agent-hook-v2/commit/9bf6c11028a70944fda3f5e7ef315915768b9be7"
      ],
      "revision": "9bf6c11028a70944fda3f5e7ef315915768b9be7",
      "stage": "source",
      "status": "passed"
    },
    {
      "artifactDigest": null,
      "component": "Python-SDK",
      "observedAt": "2026-08-28T00:00:00+00:00",
      "references": [
        "https://github.com/caglarsubas/planeon-orchestra-python-sdk/commit/3a4012d809e6ed00a3f05be940c5278eac20a166"
      ],
      "revision": "3a4012d809e6ed00a3f05be940c5278eac20a166",
      "stage": "source",
      "status": "passed"
    },
    {
      "artifactDigest": null,
      "component": "model-plane",
      "observedAt": "2026-08-28T00:00:00+00:00",
      "references": [
        "https://github.com/caglarsubas/llm_inference_engine/commit/e820728e14a6121c0549f4ef6d51baacd1fec573"
      ],
      "revision": "e820728e14a6121c0549f4ef6d51baacd1fec573",
      "stage": "source",
      "status": "passed"
    },
    {
      "artifactDigest": null,
      "component": "data-source-harness",
      "observedAt": "2026-08-28T00:00:00+00:00",
      "references": [
        "https://github.com/caglarsubas/data-source-harness/actions/runs/33092591951",
        "https://github.com/caglarsubas/data-source-harness/actions/runs/33092592077"
      ],
      "revision": "74cd16877253d7dbc0995063b8f611be767376f8",
      "stage": "exact-main-ci",
      "status": "passed"
    },
    {
      "artifactDigest": null,
      "component": "ADLC",
      "observedAt": "2026-08-28T00:00:00+00:00",
      "references": [
        "https://github.com/caglarsubas/agent-hook-v2/actions/runs/33087853316",
        "https://github.com/caglarsubas/agent-hook-v2/actions/runs/33087853263"
      ],
      "revision": "9bf6c11028a70944fda3f5e7ef315915768b9be7",
      "stage": "exact-main-ci",
      "status": "passed"
    },
    {
      "artifactDigest": null,
      "component": "model-plane",
      "observedAt": "2026-08-28T00:00:00+00:00",
      "references": [
        "https://github.com/caglarsubas/llm_inference_engine/actions/runs/32734407866"
      ],
      "revision": "e820728e14a6121c0549f4ef6d51baacd1fec573",
      "stage": "exact-main-ci",
      "status": "passed"
    }
  ],
  "generatedAt": "2026-08-28T00:00:00+00:00",
  "releaseSet": "phase-6.5-integration-spine-2026-08-27",
  "releaseSetDigest": "sha256:24ba4d423b613abb5ae576a8aed049b94bd4fdb1361d2f0171f23c61962fb83a",
  "schemaVersion": "data.harness/v1",
  "sources": [
    {
      "connectorId": "whitegoods.erp",
      "endpointReference": "credential-ref://phase7/postgresql",
      "imageDigest": null,
      "liveVerified": false,
      "observedAt": null,
      "references": [],
      "shape": "postgresql",
      "sourceId": "whitegoods.postgresql"
    },
    {
      "connectorId": "whitegoods.documents",
      "endpointReference": "credential-ref://phase7/object-store",
      "imageDigest": null,
      "liveVerified": false,
      "observedAt": null,
      "references": [],
      "shape": "s3-compatible",
      "sourceId": "whitegoods.object-store"
    },
    {
      "connectorId": "whitegoods.telemetry",
      "endpointReference": "credential-ref://phase7/event-stream",
      "imageDigest": null,
      "liveVerified": false,
      "observedAt": null,
      "references": [],
      "shape": "kafka-compatible",
      "sourceId": "whitegoods.event-stream"
    },
    {
      "connectorId": "whitegoods.service-api",
      "endpointReference": "credential-ref://phase7/service-api",
      "imageDigest": null,
      "liveVerified": false,
      "observedAt": null,
      "references": [],
      "shape": "rest",
      "sourceId": "whitegoods.service-api"
    }
  ]
}
